{
  "$schema": "https://json-schema.org/draft/2020-12/schema",
  "$id": "https://ccancellieri.github.io/ogc-dimensions/spec/building-blocks/dimension-collection/schema.json",
  "title": "Dimension Collection",
  "description": "A Records collection whose items are dimension members. Extends OGC API - Records collection with a provider object (full configuration) and a cube:dimensions property (slim reference for STAC clients).",
  "type": "object",
  "required": ["id", "itemType"],
  "properties": {
    "id": {
      "type": "string",
      "description": "Dimension collection identifier."
    },
    "title": {
      "type": "string",
      "description": "Human-readable name for the dimension."
    },
    "description": {
      "type": "string",
      "description": "Detailed description of the dimension."
    },
    "itemType": {
      "type": "string",
      "const": "record",
      "description": "Item type is always 'record' for dimension collections."
    },
    "extent": {
      "type": "object",
      "description": "Extent of the dimension. Exactly one of `temporal`, `values`, or `members` is present, dispatched on the provider's ExtentResult: temporal interval for time-ordered dims, numeric min/max for ordinal dims, and a categorical `members.count` for hierarchical or otherwise non-ordered dims that have a finite size but no orderable bounds.",
      "properties": {
        "temporal": {
          "type": "object",
          "properties": {
            "interval": {
              "type": "array",
              "items": {
                "type": "array",
                "minItems": 2,
                "maxItems": 2,
                "items": {
                  "oneOf": [
                    {"type": "string", "format": "date-time"},
                    {"type": "string", "format": "date"},
                    {"type": "null"}
                  ]
                }
              }
            }
          }
        },
        "values": {
          "type": "object",
          "description": "Numeric min/max for ordinal dimensions.",
          "properties": {
            "min": {"type": ["number", "string"]},
            "max": {"type": ["number", "string"]}
          },
          "required": ["min", "max"]
        },
        "members": {
          "type": "object",
          "description": "Categorical size for non-ordered dimensions (hierarchical, nominal). `count` MUST equal the items endpoint's numberMatched across all members (root + descendants for hierarchical providers).",
          "properties": {
            "count": {
              "type": "integer",
              "minimum": 0,
              "description": "Total number of dimension members across the full dimension (all levels for hierarchical dims)."
            }
          },
          "required": ["count"]
        }
      },
      "oneOf": [
        {"required": ["temporal"]},
        {"required": ["values"]},
        {"required": ["members"]}
      ]
    },
    "provider": {
      "$ref": "../../schema/provider.json",
      "description": "Full provider definition for this dimension — config, parameters, output schema, invertible flag, hierarchy structure, language support. This is the authoritative provider description; the slim reference in cube:dimensions.*.provider points here."
    },
    "conformsTo": {
      "type": "array",
      "items": {"type": "string", "format": "uri"},
      "description": "OGC conformance classes supported by this dimension collection (e.g. dimension-inverse, dimension-hierarchical)."
    },
    "cube:dimensions": {
      "type": "object",
      "description": "Datacube dimension definitions (STAC Datacube Extension + ogc-dimensions extensions). Contains slim provider references — follow provider.href for full details.",
      "additionalProperties": {
        "$ref": "../../schema/dimension.json"
      }
    },
    "links": {
      "type": "array",
      "items": {
        "type": "object",
        "required": ["href", "rel"],
        "properties": {
          "href": {"type": "string", "format": "uri-reference"},
          "rel": {"type": "string"},
          "type": {"type": "string"},
          "title": {"type": "string"}
        }
      }
    }
  }
}
